{
  "utility": "East Bay Community Energy",
  "utilityAbbrev": "EBCE",
  "eiaid": null,
  "state": "CA",
  "dataSource": "OpenEI URDB",
  "dataSourceUrl": "https://apps.openei.org/USURDB/",
  "lastVerified": "2025-11-29",
  "notes": "Sample rate structures for CCA generation rates. EBCE launched in 2018. Delivery charges from PG&E apply separately.",
  "rates": [
    {
      "label": "EBCE Bright Choice Commercial",
      "uri": "https://openei.org/apps/USURDB/rate/view/5f2d8e325457a36e5cb94b7c",
      "sector": "Commercial",
      "approved": true,
      "effectiveDate": "2024-01-01",
      "description": "85% renewable energy generation rate (delivery charges separate via PG&E)",
      "demandMin": 0,
      "demandMax": null,
      "fixedMonthlyCharge": 0.00,
      "demandRateStructure": [],
      "energyRateStructure": [
        {
          "season": "All",
          "period": "Generation",
          "rate": 0.08054,
          "unit": "kWh",
          "months": [1, 2, 3, 4, 5, 6, 7, 8, 9, 10, 11, 12],
          "hours": "all"
        }
      ],
      "notes": "This is generation-only rate. Add PG&E delivery charges for total cost."
    }
  ]
}
