{
  "utility": "PacifiCorp",
  "utilityAbbrev": "PacifiCorp",
  "eiaid": 14354,
  "state": "CA",
  "dataSource": "OpenEI URDB",
  "dataSourceUrl": "https://apps.openei.org/USURDB/",
  "lastVerified": "2025-11-29",
  "notes": "Sample rate structures for commercial BESS modeling. PacifiCorp serves northern California.",
  "rates": [
    {
      "label": "Schedule 32 Large General Service TOU",
      "uri": "https://openei.org/apps/USURDB/rate/view/5c6ea6d85457a3454fcc93a2",
      "sector": "Commercial",
      "approved": true,
      "effectiveDate": "2024-01-01",
      "description": "Large commercial TOU rate for demands 1000+ kW",
      "demandMin": 1000,
      "demandMax": null,
      "fixedMonthlyCharge": 425.00,
      "demandRateStructure": [
        {
          "season": "Summer",
          "period": "On-Peak Demand",
          "rate": 18.65,
          "unit": "kW",
          "months": [6, 7, 8, 9],
          "hours": "15:00-21:00 weekdays"
        },
        {
          "season": "All",
          "period": "Max Demand",
          "rate": 12.45,
          "unit": "kW",
          "months": [1, 2, 3, 4, 5, 6, 7, 8, 9, 10, 11, 12],
          "hours": "all"
        }
      ],
      "energyRateStructure": [
        {
          "season": "Summer",
          "period": "On-Peak",
          "rate": 0.16854,
          "unit": "kWh",
          "months": [6, 7, 8, 9],
          "hours": "15:00-21:00 weekdays"
        },
        {
          "season": "Summer",
          "period": "Off-Peak",
          "rate": 0.09254,
          "unit": "kWh",
          "months": [6, 7, 8, 9],
          "hours": "all other hours"
        },
        {
          "season": "Winter",
          "period": "On-Peak",
          "rate": 0.12254,
          "unit": "kWh",
          "months": [1, 2, 3, 4, 5, 10, 11, 12],
          "hours": "7:00-23:00 weekdays"
        },
        {
          "season": "Winter",
          "period": "Off-Peak",
          "rate": 0.08254,
          "unit": "kWh",
          "months": [1, 2, 3, 4, 5, 10, 11, 12],
          "hours": "23:00-7:00 weekdays, all day weekends/holidays"
        }
      ]
    }
  ]
}
